{
  "$schema": "http://json-schema.org/draft-07/schema#",
  "$id": "https://dorevia.plateform/schemas/manifest.schema.json",
  "title": "Dorevia Platform Manifest Schema",
  "description": "Schéma de validation pour les manifests Phase 1 - Configuration déclarative complète",
  "type": "object",
  "required": [
    "tenant_id",
    "universes",
    "environments",
    "domain_mode",
    "units"
  ],
  "properties": {
    "tenant_id": {
      "type": "string",
      "description": "Identifiant du tenant (slug technique DNS)",
      "pattern": "^[a-z0-9]([a-z0-9-]{0,61}[a-z0-9])?$",
      "examples": ["core", "dido", "rozas"]
    },
    "universes": {
      "type": "array",
      "description": "Liste des univers fonctionnels activés",
      "minItems": 1,
      "items": {
        "type": "string",
        "enum": ["odoo", "pos", "sylius", "suitecrm", "n8n"]
      },
      "uniqueItems": true,
      "examples": [["odoo"], ["odoo", "pos"], ["odoo", "suitecrm", "n8n"]]
    },
    "environments": {
      "type": "array",
      "description": "Liste des environnements activés",
      "minItems": 1,
      "items": {
        "type": "string",
        "enum": ["lab", "stinger", "prod"]
      },
      "uniqueItems": true,
      "examples": [["lab", "stinger"], ["lab", "stinger", "prod"]]
    },
    "domain_mode": {
      "type": "string",
      "description": "Mode de domaine (Phase 3: saas, client, hybrid)",
      "enum": ["saas", "client", "hybrid"],
      "default": "saas"
    },
    "domains": {
      "type": "object",
      "description": "Configuration domaines (Phase 3: domaines clients et alias)",
      "properties": {
        "canonical": {
          "type": "string",
          "description": "Domaine canonique (selon mode: doreviateam.com ou domaine client)",
          "pattern": "^[a-z0-9]([a-z0-9.-]*[a-z0-9])?$",
          "examples": ["doreviateam.com", "rozas.gp"]
        },
        "aliases": {
          "type": "object",
          "description": "Alias DNS par scope (global ou par service)",
          "properties": {
            "global": {
              "type": "array",
              "description": "Alias global (tous les services)",
              "items": {
                "type": "string",
                "pattern": "^[a-z0-9]([a-z0-9.-]*[a-z0-9])?$"
              },
              "uniqueItems": true,
              "examples": [["erp.rozas.gp"]]
            },
            "odoo": {
              "type": "array",
              "description": "Alias pour service Odoo",
              "items": {
                "type": "string",
                "pattern": "^[a-z0-9]([a-z0-9.-]*[a-z0-9])?$"
              },
              "uniqueItems": true,
              "examples": [["erp.rozas.gp", "crm.rozas.gp"]]
            },
            "dvig": {
              "type": "array",
              "description": "Alias pour service DVIG",
              "items": {
                "type": "string",
                "pattern": "^[a-z0-9]([a-z0-9.-]*[a-z0-9])?$"
              },
              "uniqueItems": true,
              "examples": [["api.rozas.gp", "auth.rozas.gp"]]
            },
            "vault": {
              "type": "array",
              "description": "Alias pour service Vault",
              "items": {
                "type": "string",
                "pattern": "^[a-z0-9]([a-z0-9.-]*[a-z0-9])?$"
              },
              "uniqueItems": true,
              "examples": [["docs.rozas.gp"]]
            }
          },
          "additionalProperties": false
        },
        "fallback": {
          "type": "boolean",
          "description": "Conserver domaine Dorevia en fallback (obligatoire si mode client)",
          "default": true
        }
      },
      "additionalProperties": false
    },
    "prod": {
      "type": "object",
      "description": "Configuration production (Phase 3: serveur client)",
      "properties": {
        "target": {
          "type": "string",
          "description": "Cible de déploiement PROD",
          "enum": ["doreviateam", "client", "hybrid", "unknown"],
          "default": "unknown"
        },
        "server_name": {
          "type": "string",
          "description": "Nom du serveur client (si target=client ou hybrid)",
          "pattern": "^[a-z0-9]([a-z0-9-]*[a-z0-9])?$",
          "examples": ["ionos-rozas"]
        },
        "public_ip": {
          "type": "string",
          "description": "IP publique du serveur client",
          "pattern": "^([0-9]{1,3}\\.){3}[0-9]{1,3}$",
          "examples": ["192.168.1.100"]
        },
        "base_domain": {
          "type": "string",
          "description": "Domaine de base pour PROD (si différent du domaine canonique)",
          "pattern": "^[a-z0-9]([a-z0-9.-]*[a-z0-9])?$",
          "examples": ["rozas.gp"]
        },
        "dns_managed_by": {
          "type": "string",
          "description": "Qui gère le DNS (doreviateam ou client)",
          "enum": ["doreviateam", "client"],
          "default": "doreviateam"
        }
      },
      "additionalProperties": false
    },
    "units": {
      "type": "object",
      "description": "Liste des units techniques à déployer par catégorie. Note: platform peut être un tableau vide [] pour créer un tenant sans services platform (DVIG/Vault optionnels selon SPEC_DVIG_VAULT_OPTIONNELS_v1.0)",
      "required": ["platform"],
      "properties": {
        "platform": {
          "type": "array",
          "description": "Units de la plateforme (services partagés). Peut être vide pour créer un tenant sans services platform (DVIG/Vault optionnels).",
          "minItems": 0,
          "items": {
            "type": "string",
            "enum": ["dvig", "vault", "postgres"]
          },
          "uniqueItems": true,
          "examples": [["dvig", "vault", "postgres"], []]
        },
        "odoo": {
          "type": "array",
          "description": "Units pour l'univers odoo",
          "items": {
            "type": "string",
            "enum": ["odoo", "postgres"]
          },
          "uniqueItems": true,
          "examples": [["odoo", "postgres"]]
        },
        "pos": {
          "type": "array",
          "description": "Units pour l'univers pos",
          "items": {
            "type": "string",
            "enum": ["pos", "postgres"]
          },
          "uniqueItems": true
        },
        "sylius": {
          "type": "array",
          "description": "Units pour l'univers sylius",
          "items": {
            "type": "string",
            "enum": ["sylius", "postgres"]
          },
          "uniqueItems": true
        },
        "suitecrm": {
          "type": "array",
          "description": "Units pour l'univers suitecrm",
          "items": {
            "type": "string",
            "enum": ["suitecrm", "mariadb"]
          },
          "uniqueItems": true,
          "examples": [["suitecrm", "mariadb"]]
        },
        "n8n": {
          "type": "array",
          "description": "Units pour l'univers n8n",
          "items": {
            "type": "string",
            "enum": ["n8n", "postgres"]
          },
          "uniqueItems": true,
          "examples": [["n8n", "postgres"]]
        }
      },
      "additionalProperties": false
    },
    "secrets_refs": {
      "type": "object",
      "description": "Références vers les secrets (chemins/variables), sans secrets en clair",
      "properties": {
        "dvig_tokens": {
          "type": "string",
          "description": "Chemin vers le fichier de tokens DVIG",
          "pattern": "^tenants/[^/]+/secrets/.+\\.ya?ml$",
          "examples": ["tenants/core/secrets/dvig.tokens.yml"]
        }
      },
      "additionalProperties": false
    },
    "images": {
      "type": "object",
      "description": "Versions d'images Docker utilisées",
      "properties": {
        "dvig": {
          "type": "string",
          "description": "Image Docker DVIG",
          "pattern": "^[^:]+:[^:]+$",
          "examples": ["dorevia/dvig:0.1.2-auth"]
        },
        "vault": {
          "type": "string",
          "description": "Image Docker Vault",
          "pattern": "^[^:]+:[^:]+$",
          "examples": ["dorevia/vault:v1.3.0"]
        },
        "odoo": {
          "type": "string",
          "description": "Image Docker Odoo",
          "pattern": "^[^:]+:[^:]+$",
          "examples": ["odoo:18.0-20250819"]
        },
        "postgres": {
          "type": "string",
          "description": "Image Docker PostgreSQL",
          "pattern": "^[^:]+:[^:]+$",
          "examples": ["postgres:16"]
        },
        "suitecrm": {
          "type": "string",
          "description": "Image Docker SuiteCRM",
          "pattern": "^[^:]+:[^:]+$",
          "examples": ["bitnami/suitecrm:8"]
        },
        "mariadb": {
          "type": "string",
          "description": "Image Docker MariaDB (univers suitecrm)",
          "pattern": "^[^:]+:[^:]+$",
          "examples": ["mariadb:11"]
        },
        "n8n": {
          "type": "string",
          "description": "Image Docker n8n",
          "pattern": "^[^:]+:[^:]+$",
          "examples": ["n8nio/n8n:latest"]
        }
      },
      "additionalProperties": false
    },
    "created_at": {
      "type": "string",
      "description": "Date de création du manifest (ISO 8601)",
      "format": "date-time",
      "examples": ["2025-01-28T00:00:00Z"]
    },
    "version": {
      "type": "string",
      "description": "Version du manifest",
      "pattern": "^\\d+\\.\\d+(\\.\\d+)?$",
      "examples": ["1.0", "1.0.0"]
    }
  },
  "additionalProperties": false
}

