{
  "version": "1.0",
  "tenant_id": "lab",
  "created_at": "2026-02-01T00:00:00Z",
  "universes": ["odoo", "suitecrm", "n8n"],
  "environments": ["lab", "stinger"],
  "domain_mode": "saas",
  "units": {
    "platform": [],
    "odoo": ["odoo", "postgres"],
    "suitecrm": ["suitecrm", "mariadb"],
    "n8n": ["n8n", "postgres"]
  },
  "images": {
    "odoo": "odoo:18.0-20250819",
    "postgres": "postgres:16",
    "suitecrm": "bitnami/suitecrm:8",
    "mariadb": "mariadb:11",
    "n8n": "n8nio/n8n:latest"
  }
}
